{
  "schemaVersion": "1.0.0",
  "id": "animated-number-count-up",
  "name": "Animated number count-up",
  "category": "text",
  "definition": "A figure rolls from 0 up to its value.",
  "bestUse": "Landing a headline number.",
  "trigger": [
    "single-key-number"
  ],
  "level": "standard",
  "sources": [
    "common"
  ],
  "demo": {
    "file": "demos/animated-number-count-up.html",
    "kind": "animated",
    "how": "The headline number starts at zero and rolls up to its value with an ease-out, so it slows and settles before the eye reads it. Play counts it up, then adds a context line comparing it with last year. Under reduced motion the final number appears directly."
  },
  "related": [
    "kpi-tile"
  ]
}
